{
  "schema_version": 1,
  "milestone": "phase-2a-controller-serial-candidate-v1",
  "license": "GPL-3.0-only",
  "status": "Hardware Unverified",
  "measurement_date": "2026-07-20",
  "environment": {
    "machine": "DESKTOP-IQM6HN5",
    "cpu": "11th Gen Intel(R) Core(TM) i7-11800H @ 2.30GHz",
    "ram_bytes": 16964685824,
    "architecture": "x86_64",
    "os": "Microsoft Windows 11 Home China 25H2",
    "windows_build": "10.0.26200.8875",
    "power_plan": "GamePP 电源方案",
    "rustc": "1.97.1 (8bab26f4f 2026-07-14)",
    "cargo": "1.97.1 (c980f4866 2026-06-30)"
  },
  "harness": {
    "transport": "non-blocking-memory",
    "warmup_samples": 1000,
    "eligible_samples": 10000,
    "minimum_report_interval_ns": 1,
    "measurement_elapsed_ms": 60,
    "outlier_filtering": false,
    "permanent_busy_wait": false,
    "raw_csv_rows": 10001,
    "raw_csv_sha256": "8A7C803777E70D30F92898C23E3DF3821973C49D691DE4481E22066D45A0DCA6"
  },
  "metrics": {
    "command_admitted_to_lane_wake_ns": { "p50": 800, "p95": 1000, "p99": 4800, "max": 147200 },
    "lane_wake_to_dispatch_ns": { "p50": 700, "p95": 800, "p99": 1000, "max": 8500 },
    "dispatch_to_transport_write_entered_ns": { "p50": 200, "p95": 300, "p99": 400, "max": 6000 },
    "transport_write_entered_to_acceptance_ns": { "p50": 100, "p95": 100, "p99": 100, "max": 3000 },
    "command_admitted_to_transport_write_entered_ns": { "p50": 1600, "p95": 1900, "p99": 5800, "max": 148500 },
    "command_admitted_to_transport_acceptance_ns": { "p50": 1700, "p95": 2000, "p99": 5900, "max": 148600 }
  },
  "target": {
    "metric": "command_admitted_to_transport_write_entered_ns",
    "p99_ns": 1000000,
    "max_ns": 5000000,
    "passed": true
  },
  "scope": "This result measures only the in-process Controller software path to a non-blocking memory transport; it is not UART, CH32, USB HID, Switch bus, firmware, or gameplay latency evidence."
}
